	ID	sentence	question	1	2	answer
1513	1514	배를 타고 여행을 갔다.	원인	비행기 표가 없었다.	바닷가에 세찬 바람이 불었다.	1
1514	1515	범인이 체포되었다.	원인	탐정이 범인의 단서를 발견하지 못했다.	탐정이 범인의 결정적인 단서를 발견했다.	2
1515	1516	옷을 입은 채 냇가에 들어갔다.	결과	옷이 모두 젖었다.	옷이 모두 말랐다.	1
1516	1517	다이어트를 시작했다.	결과	매일 운동을 한다.	음식을 많이 먹는다.	1
1517	1518	남성은 맛이 잘 느껴지지 않는다.	원인	남성은 운동을 열심히 했다.	남성은 코가 막혔다.	2
1518	1519	여자가 수프를 호호 불었다.	원인	수프가 뜨겁다.	수프가 차갑게 식었다.	1
1519	1520	여자는 혀를 데였다.	원인	여자는 차가운 물을 급하게 마셨다.	여자는 뜨거운 물을 급하게 마셨다.	2
1520	1521	여자는 연인과 크게 싸웠다.	결과	여자는 연인과 여행을 갔다.	여자는 연인과 헤어졌다.	2
1521	1522	코인세탁소에 갔다.	결과	빨래집게가 부러졌다.	이불 세탁을 했다.	2
1522	1523	우리 팀 선수가 농구 골대에 농구공을 넣었다.	결과	우리 팀이 점수를 얻었다.	우리 팀이 점수를 잃었다.	1
1523	1524	한 남성이 슬퍼한다.	원인	남성은 선물을 받았다.	남성의 어머니가 돌아가셨다.	2
1524	1525	사진기의 플래시가 터졌다.	결과	저절로 입이 벌어졌다.	저절로 눈이 깜박였다.	2
1525	1526	지갑을 잃어버렸다.	결과	용돈을 받았다.	카드 분실 신고를 했다.	2
1526	1527	고추를 먹었다.	결과	혀가 얼얼하다.	혀가 말랑하다.	1
1527	1528	자동차 기름이 다 떨어졌다.	결과	주유소에 간다.	정비소에 간다.	1
1528	1529	팝콘이 튀겨지기 시작했다.	원인	팝콘에 버터를 부었다.	옥수수를 전자레인지에 돌렸다.	2
1529	1530	니트를 뜨거운 물로 빨래했다.	결과	니트가 줄어들었다.	니트가 사라졌다.	1
1530	1531	남자는 청바지를 구입했다.	원인	남자는 주민센터에 갔다.	남자는 옷가게에 갔다.	2
1531	1532	아이가 점원에게 돈을 건넸다.	원인	아이가 가게에 물건을 사러 갔다.	아이가 집에 갔다.	1
1532	1533	맨발로 유리조각을 밟았다.	결과	발에 상처가 난다.	유리가 깨진다.	1
1533	1534	자동차가 갑자기 멈췄다.	원인	자동차의 기름이 다 떨어졌다.	목적지에 도착하려면 아직 멀었다.	1
1534	1535	버터를 달군 후라이팬 위에 올렸다.	결과	버터가 녹아 액체가 되었다.	버터가 딱딱하게 굳었다.	1
1535	1536	여자는 내과에 갔다.	원인	여자는 배탈이 났다.	여자는 충치가 생겼다.	1
1536	1537	공부하느라 밤을 샜다.	결과	오늘 수업시간 내내 졸았다. 	오늘 수업은 흥미로웠다.	1
1537	1538	콩을 발효시켰다.	결과	고추장이 완성되었다.	청국장이 완성되었다.	2
1538	1539	된장과 고추장을 섞었다.	결과	간장이 되었다.	쌈장이 되었다.	2
1539	1540	어린 소년이 수영장 난간에 붙어 있다.	원인	소년은 수영 배우는 것을 무서워한다.	인명 구조원이 수영장 옆에서 근무중이다.	1
1540	1541	버터를 실온에 두었다.	결과	버터가 얼었다.	버터가 녹았다.	2
1541	1542	야외 빨랫줄에 린넨 셔츠를 걸었다.	결과	린넨 셔츠가 말랐다.	린넨 셔츠가 얼룩졌다.	1
1542	1543	게임에서 계속 이겼다.	결과	레벨이 떨어졌다.	레벨이 올라갔다.	2
1543	1544	발바닥에 땀이 난다.	원인	밑창이 두꺼운 운동화를 신고 달렸다.	발을 씻었다.	1
1544	1545	여자는 포장지를 구입했다.	원인	여자는 선물을 준비했다.	여자는 선물을 받았다.	1
1545	1546	머리가 아프다.	결과	약을 바닥에 버렸다.	약을 먹었다. 	2
1546	1547	목에 생선 가시가 걸렸다.	결과	목이 따끔거린다.	눈이 따끔거린다.	1
1547	1548	남자가 트라우마를 겪고 있다.	원인	남자가 큰 사고를 당했다.	남자가 밥을 먹었다.	1
1548	1549	여자는 향수를 느꼈다.	원인	여자는 오랜만에 동창을 만났다.	여자는 아이들에게 소리 질렀다.	1
1549	1550	판매원이 환불을 거절했다.	원인	손님이 영수증을 잃어버렸다.	손님이 옷을 샀다.	1
1550	1551	책상이 끈적하다.	결과	책상에 엎드려 잠을 잤다.	책상을 걸레질했다.	2
1551	1552	티비 리모콘의 배터리가 다 닳았다.	결과	티비 채널을 변경할 수 없다.	티비 채널을 마음대로 변경했다.	1
1552	1553	남성은 대학에서 물리를 가르친다.	원인	남성의 전공은 물리학이다.	남성의 전공은 언어학이다.	1
1553	1554	농작물이 모두 시들었다.	원인	가뭄이 심하게 들었다.	알맞은 정도의 비가 내렸다.	1
1554	1555	남자가 우산을 접었다.	원인	밖에 비가 그쳤다.	밖에 비가 내리기 시작했다.	1
1555	1556	마늘 껍질을 벗겼다.	결과	손이 촉촉해졌다.	눈이 알싸했다.	2
1556	1557	간암에 걸렸다.	결과	간을 기증했다.	간 이식을 받았다.	2
1557	1558	여자는 미국 영주권을 취득했다.	원인	여자는 미국에서 오랫동안 살았다.	여자는 한국에서 오랫동안 살았다.	1
1558	1559	휴대폰 배터리가 100퍼센트이다.	원인	4시간 동안 휴대폰 게임을 했다.	충전을 완료했다.	2
1559	1560	나무에서 나뭇잎이 떨어졌다.	결과	나뭇잎이 붉게 물들었다.	나뭇잎이 길가에 쌓였다.	2
1560	1561	휴대폰 밝기를 최대한 낮췄다.	결과	휴대폰 화면이 선명하게 보인다.	휴대폰 화면이 선명하지 않게 보인다.	2
1561	1562	음식물 쓰레기를 버렸다.	원인	음식을 깨끗하게 다 먹었다.	음식물 쓰레기 때문에 악취가 난다.	2
1562	1563	아무도 그 교수의 수업을 수강신청하지 않았다.	결과	그 교수의 수업이 폐강되었다.	그 교수는 매우 인기가 좋다.	2
1563	1564	남성은 욕실 바닥에서 미끄러졌다.	원인	욕실 바닥이 건조했다.	욕실 바닥에 물기가 있었다.	2
1564	1565	여자가 활시위를 당겼다.	결과	과녁에 맞았다.	과녁이 부서졌다.	1
1565	1566	비가 많이 내렸다.	결과	도로가 건조하다.	도로가 젖었다.	2
1566	1567	닭이 계란을 품었다.	결과	병아리가 부화하였다.	계란이 깨졌다.	1
1567	1568	소녀가 랜드마크 앞에서 포즈를 취하고 있다.	원인	소녀의 어머니가 소녀의 사진을 찍고 있다.	소녀의 아버지가 떠날 채비를 하고 있다.	1
1568	1569	배드버그에 물렸다.	결과	이불을 빨았다.	이불을 갰다.	1
1569	1570	도서관이 문을 닫았다.	원인	도서관의 정기휴일이다.	새로운 도서관이 생겼다.	1
1570	1571	야구경기에서 득점이 발생했다.	원인	타자가 홈런을 쳤다.	타자가 삼진 아웃 되었다.	1
1571	1572	아이에게 자장가를 불러주었다.	결과	아이가 잠에 들지 못했다.	아이가 잠에 들었다.	2
1572	1573	유성펜으로 쓴 글씨에 물을 뿌렸다.	결과	글씨가 지워졌다.	글씨가 지워지지 않았다.	2
1573	1574	머리에서 냄새가 난다.	결과	머리를 감았다.	몸을 닦았다.	1
1574	1575	학생이 숙제를 제출했다.	결과	선생님에게 칭찬을 받았다.	선생님에게 꾸중을 들었다.	1
1575	1576	비행기가 난기류를 만났다.	결과	비행기가 흔들린다.	비행기가 안정적으로 운행된다.	1
1576	1577	사람들이 모두 건물 밖으로 대피했다.	원인	건물에 화재 경보가 작동했다.	건물 안의 사람들이 모두 곤히 잠들었다.	1
1577	1578	서점에서 책을 구매했다.	원인	읽고 싶은 책이 있었다.	서점이 멀리 있다.	1
1578	1579	사무실이 시끄럽다.	원인	사무실 옆 건물이 공사중이다.	사무실에 혼자 앉아있다.	1
1579	1580	배에서 꼬르륵 소리가 난다.	원인	아침을 까먹고 먹지 않았다.	아침을 배부르게 먹었다.	1
1580	1581	남성이 식후 혈당을 체크한다.	원인	남성은 치매가 있다.	남성은 당뇨가 있다.	2
1581	1582	마이크에 대고 말을 한다.	결과	목소리가 크게 울린다.	목소리가 들리지 않는다.	1
1582	1583	바늘로 풍선을 터뜨렸다.	결과	풍선에서 큰 소리가 났다.	풍선이 커졌다.	1
1583	1584	밀크티에서 시큼한 냄새가 난다.	원인	밀크티를 버렸다.	밀크티가 상했다.	2
1584	1585	동물원에 갔다.	결과	좋아하는 책을 봤다.	사자를 봤다.	2
1585	1586	여자는 상금을 받았다.	원인	여자는 대회에서 우승했다.	여자는 대회에 출전하지 않았다.	1
1586	1587	배탈이 났다.	결과	비타민을 먹었다.	소화제를 먹었다.	2
1587	1588	여자가 장시간 동안 철봉을 탔다.	결과	손에 물집이 잡혔다.	발에 물집이 잡혔다.	1
1588	1589	대도시의 밤하늘에 별이 많이 보인다.	원인	대도시의 인구 수가 많다.	공기가 매우 맑은 날이다.	1
1589	1590	여자가 복권 당첨금을 수령했다.	원인	여자가 복권에 당첨되었다.	여자가 복권에 당첨되지 않았다.	1
1590	1591	알람 시계가 울린다.	결과	알람을 맞추었다.	알람을 듣고 일어났다.	2
1591	1592	감독이 촬영 시작 사인을 냈다.	결과	배우가 연기를 시작했다.	배우가 연기를 마쳤다.	1
1592	1593	텀블러를 가져오지 않았다. 	결과	밥을 먹지 못했다.	물을 마시지 못했다.	2
1593	1594	갑자기 브레이크를 밟았다.	원인	길에서 고양이가 튀어나왔다. 	길 고양이를 집으로 데려왔다.	1
1594	1595	여성은 현관 비밀번호를 까먹었다.	결과	여성은 비밀번호를 바꾼지 얼마 되지 않았다.	여성은 집에 들어가지 못했다.	2
1595	1596	흙바닥에 사탕을 떨어트렸다.	결과	사탕 주변으로 개미가 꼬였다.	사탕 주변에 물이 생겼다.	1
1596	1597	고무줄을 잡아당겼다.	결과	고무줄이 날라갔다.	고무줄이 늘어났다.	2
1597	1598	빗물에 휴대폰이 젖었지만 고장나지 않았다.	원인	휴대폰은 방수 기능이 없다.	휴대폰에 방수 기능이 있다.	2
1598	1599	남자는 뒷문으로 건물을 빠져나왔다.	원인	정문이 폐쇄되었다.	정문이 열려있었다.	1
1599	1600	남자는 망각 증세가 심하다.	결과	남자는 노래를 불렀다.	남자는 자주 메모했다.	2
1600	1601	거리에 연등이 달려 있다.	원인	오늘은 제헌절이다.	오늘은 개천절이다.	2
1601	1602	머리를 감지 않은 남자가 외출을 하려고 한다.	결과	남자가 목도리를 둘렀다.	남자가 모자를 썼다.	2
1602	1603	운동 중에 이온음료를 마셨다.	원인	목이 마르다.	허리가 아프다	1
1603	1604	허리끈을 세게 조였다.	결과	숨쉬기가 편해졌다.	숨쉬기가 불편해졌다.	2
1604	1605	남자가 국가유공자로 지정되었다.	원인	남자는 국가에 헌신했다.	남자는 국가를 배신했다.	1
1605	1606	남성은 선크림을 발랐다.	원인	남성은 그늘에 앉아 있을 예정이다.	남성은 해변에 나갈 예정이다.	2
1606	1607	급여를 받았다.	원인	쇼핑을 신나게 했다.	일을 열심히 했다.	2
1607	1608	옷장에 제습제를 넣었다.	결과	옷장 속의 습기가 사라졌다.	옷장 속의 습기가 증가했다.	1
1608	1609	발목 인대가 늘어났다.	결과	발에 깁스를 했다.	발에 반창고를 붙였다.	1
1609	1610	화이트보드에 분필로 글자를 적었다.	결과	글자가 선명하게 적혔다.	글자가 잘 적히지 않았다.	2
1610	1611	아이의 목이 쉬었다.	원인	아이가 조용한 목소리로 이야기를 많이 했다.	아이가 소리를 많이 질렀다.	2
1611	1612	이어폰에서 소리가 나오지 않는다.	원인	이어폰이 제대로 꽂히지 않았다.	이어폰을 새로 구입했다.	1
1612	1613	비밀번호를 잘못 입력했다.	결과	로그인이 되었다.	로그인이 되지 않는다.	2
1613	1614	선생님이 학생을 칭찬했다.	원인	학생이 질문에 올바르게 답을 했다.	학생이 선생님에게 욕을 했다.	1
1614	1615	계산원이 카운터의 금전 등록기를 열었다.	원인	손님이 신용카드를 내밀었다.	손님이 현금을 내밀었다.	2
1615	1616	하수구에 커다란 부품이 들어갔다.	결과	하수구가 막힌다.	하수구가 뚫린다.	1
1616	1617	아이가 하품을 한다.	원인	아이는 졸리다.	아이는 놀랐다.	1
1617	1618	조개에 모래가 씹혔다.	원인	조개 해감을 제대로 시켰다.	조개 해감이 제대로 되지 않았다.	2
1618	1619	세탁물이 잘 마르지 않는다.	원인	하루종일 비가 온다.	하루종일 해가 쨍쨍하다.	1
1619	1620	상처를 소독했다.	결과	상처가 오염됐다.	상처가 깨끗해졌다.	2
1620	1621	직원이 여성을 객실로 안내했다.	원인	한 여성이 직원에게 객실이 어디인지 물어봤다.	여성이 직원에게 키를 반납했다.	1
1621	1622	사장은 직원을 째려보았다.	원인	사장은 직원이 한 일이 마음에 든다.	사장은 직원이 한 일이 마음에 들지 않는다.	2
1622	1623	남자는 다리에 깁스를 했다.	원인	남자는 다리가 부러졌다.	남자는 다리털을 밀었다.	1
1623	1624	마당에 잡초가 무성해졌다.	원인	여름이 되었다.	겨울이 되었다.	1
1624	1625	벼루에 물을 담고 먹을 갈았다.	결과	벼루 안의 물이 투명해졌다.	먹물이 만들어졌다.	2
1625	1626	침구에 섬유향수를 뿌렸다.	결과	침구에서 악취가 난다.	침구에서 좋은 향기가 난다.	2
1626	1627	더러운 손으로 눈을 비볐다.	결과	눈병이 생긴다.	눈이 감긴다.	1
1627	1628	선수단이 동계 훈련을 떠났다.	결과	선수들의 기량이 높아졌다.	선수들의 키가 커졌다.	1
1628	1629	딱지를 뜯었다.	결과	딱지가 있던 자리에서 피가 난다.	딱지가 있던 자리에서 땀이 난다.	1
1629	1630	나는 불쾌하다.	원인	모르는 여자가 나를 째려본다.	제일 친한 친구가 나에게 말을 걸었다.	1
1630	1631	강아지가 오랜만에 주인을 만났다.	결과	강아지가 꼬리를 흔든다.	강아지가 짖는다.	1
1631	1632	토끼의 귀가 쫑긋거린다.	원인	토끼가 병원에서 마취제를 맞고 잠들었다.	토끼가 어떤 소리를 포착했다.	2
1632	1633	여자가 고양이의 눈 주위를 휴지로 닦았다.	원인	고양이의 코에 코딱지가 끼었다.	고양이의 눈에 눈곱이 끼었다.	2
1633	1634	아이가 거리에서 울고 있다.	원인	아이는 장난감을 받았다.	아이는 길을 잃어버렸다.	2
1634	1635	남자는 수수께끼 푸는 것을 어려워했다.	결과	남자가 수수께끼를 풀었다.	남자는 힌트를 요청했다.	2
1635	1636	눈이 충혈되었다.	원인	오랫동안 컴퓨터 게임을 했다. 	부루마블을 했다.	1
1636	1637	눈에 멍이 들었다.	결과	눈이 부어 앞이 보이지 않는다.	눈의 붓기가 빠져 앞지 잘 보인다.	1
1637	1638	핸드크림을 발랐다.	원인	손이 건조하다.	손에서 향기가 난다.	1
1638	1639	거실에 트리를 설치했다.	원인	크리스마스가 다가 왔다.	발렌타인데이가 다가 왔다.	1
1639	1640	조개껍질을 주웠다.	원인	등산을 갔다.	바다에 갔다.	2
1640	1641	대기표를 뽑았다.	원인	차례를 기다리는 사람이 많다.	차례를 기다리는 사람이 적다.	1
1641	1642	우리팀 선수가 홈런을 쳤다.	원인	우리팀 관객이 실망했다.	우리팀 관객이 신나서 응원가를 불렀다.	2
1642	1643	얼음을 냉동실에 보관했다.	결과	얼음이 녹았다.	얼음이 녹지 않았다.	2
1643	1644	세탁이 끝난 옷을 세탁기에서 꺼냈다.	결과	옷이 더러워졌다.	옷을 햇볕이 잘 드는 빨래 건조대에 널었다.	2
1644	1645	남자가 근육통이 심한 부위에 물리치료를 받았다.	결과	남자의 근육통이 심해졌다.	남자의 근육통이 완화되었다.	2
1645	1646	감독이 촬영 종료 사인을 날렸다.	원인	감독이 원하는 장면을 모두 촬영했다.	감독이 원하는 장면을 아직 촬영하지 못했다.	1
1646	1647	아이들이 고아원으로 보내졌다.	원인	아이들의 부모님이 아프다.	아이들의 부모님이 돌아가셨다.	2
1647	1648	여자는 상복을 입었다.	원인	여자의 가족이 결혼한다.	여자의 가족이 죽었다.	2
1648	1649	선풍기 날개를 세척했다.	원인	선풍기 바람이 강해졌다.	선풍기를 오랫동안 사용하지 않았다.	2
1649	1650	남자는 내일 출근하지 않는다.	원인	내일은 월요일이다.	내일은 공휴일이다.	2
1650	1651	그가 연필깎이에 연필을 넣고 돌렸다.	결과	연필이 뭉툭해졌다.	연필이 뾰족하게 깎였다.	2
1651	1652	면봉에 귀지가 묻었다. 	원인	면봉으로 귀를 팠다.	귀이개로 귀를 팠다.	1
1652	1653	휴대폰을 떨어뜨렸다.	결과	폰 액정이 깨졌다.	전화를 오랫동안 했다.	1
1653	1654	여성은 모기에 물렸다.	결과	여성은 가려움을 느낀다.	여성은 피곤함을 느낀다.	1
1654	1655	땀이 난다.	원인	냉탕에 들어갔다.	더운 사우나에서 찜질을 했다.	2
1655	1656	시험을 망쳤다.	원인	밤새 게임을 했다.	문제집을 다 풀었다.	1
1656	1657	건물 주차장이 텅텅 비었다.	결과	길 건너편에 주차했다.	주차장에 주차했다.	2
1657	1658	중고차를 구입했다.	결과	차가 금방 망가졌다.	차를 잃어버렸다.	1
1658	1659	손가락에 반지가 꼈다.	결과	손가락이 부었다.	손가락이 잘 움직인다.	1
1659	1660	아이가 장화를 신었다.	원인	아이가 밖으로 나가려고 한다.	아이가 집으로 들어오려고 한다.	1
1660	1661	그 남자는 군중 속에서 눈에 띄었다.	원인	남자가 배낭을 메고 있었다.	남자가 네온 조끼를 입고 있었다.	2
1661	1662	기차가 속도를 줄였다.	원인	기차가 역에 접근하는 중이었다.	기차가 연착되었다.	1
1662	1663	부동산 공인중개사 사무소에 갔다.	원인	자취방을 알아보려고 한다.	자취방 청소를 했다.	1
1663	1664	비닐봉투가 찢어졌다.	원인	봉투에 날카롭고 무거운 물건이 들어있었다.	봉투에 가벼운 물건이 들어있었다.	1
1664	1665	친구들이 보드게임 진행 방법을 내게 설명해주었다.	결과	나는 보드게임 하는 법을 배웠다.	나는 보드게임 하는 법을 모른다.	1
1665	1666	바닷물이 깨끗해졌다.	원인	해수욕장을 몇 년간 봉쇄했다.	피서객들이 바다에 많이 들렀다.	1
1666	1667	나뭇가지가 부러졌다.	원인	나뭇가지를 힘주어 잡아당겼다.	나뭇가지에 물을 뿌렸다.	1
1667	1668	어깨에 쿨 파스를 붙였다.	원인	어깨에 상처가 있다.	어깨 근육이 뭉쳐 아프다.	2
1668	1669	가게가 리모델링 공사를 마쳤다.	결과	가게가 다시 오픈했다.	가게가 폐업했다.	1
1669	1670	노인이 중풍을 앓게 되었다.	결과	노인의 아들이 파티를 위해 방문했다.	노인의 아들이 간병을 위해 방문했다.	2
1670	1671	환자가 의식불명이 되었다.	원인	환자가 마음의 병이 생겼다.	환자가 뇌졸중으로 쓰러졌다.	2
1671	1672	감의 껍질을 벗겨 말렸다.	결과	곶감이 만들어졌다.	감미료가 만들어졌다.	1
1672	1673	거실 바닥에서 넘어졌다.	원인	거실 바닥이 미끄럽다.	거실 바닥이 차다.	1
1673	1674	나는 동생에게 사과했다.	원인	동생의 이불을 정리했다.	동생의 이불에 커피를 쏟았다.	2
1674	1675	아이가 안경을 새로 맞췄다.	원인	아이의 시력이 나빠졌다.	아이의 시력이 좋아졌다.	1
1675	1676	커플링을 던졌다.	원인	연인이 싸웠다.	연인이 데이트를 했다.	1
1676	1677	도라지를 끓는 물에 넣었다.	결과	도라지가 물에 우려져, 도라지물이 완성되었다.	도라지가 딱딱하게 굳었다.	1
1677	1678	자전거를 대여했다.	원인	자전거를 가져오지 않았다.	자전거를 새로 샀다.	1
1678	1679	남성은 도서관에서 책을 빌릴 수 없다.	원인	남성은 반납하지 않은 책이 있다.	남성은 운동을 했다.	1
1679	1680	아버지는 아들의 알코올 중독에 분개했다.	결과	아버지는 아들을 집에서 내보냈다.	아버지는 아들에게 맥주를 사줬다.	1
1680	1681	길을 가다 넘어졌다.	원인	신발을 갈아신었다.	돌부리에 발이 걸렸다.	2
1681	1682	남자가 집으로 간다.	원인	남자는 퇴근했다.	남자는 출근했다.	1
1682	1683	일주일 내내 폭우가 왔다.	결과	강이 범람하고 홍수가 났다.	가뭄이 들어서 강이 메말랐다.	1
1683	1684	연필을 깎았다.	원인	연필이 날카롭다.	연필이 부러졌다.	2
1684	1685	여자가 연극 무대에서 울음을 터뜨렸다.	원인	여자는 무대 공포증이 있다.	여자는 연극 대사를 잘 외웠다.	1
1685	1686	동생에게 노트북을 빌려주었다.	원인	동생의 컴퓨터가 고장났다.	동생이 컴퓨터를 선물받았다.	1
1686	1687	드라이버로 의자 다리의 나사를 조였다.	원인	의자 다리가 흔들거렸다.	의자 다리가 흔들리지 않는다.	1
1687	1688	점심을 급하게 먹었다.	원인	시간이 촉박했다.	시간이 여유로웠다.	1
1688	1689	남자는 향수병에 걸렸다.	원인	남자는 동생과 말 다툼을 했다.	남자는 3년째 외국에서 거주 중이다.	2
1689	1690	비누의 부피가 줄어들었다.	원인	비누를 오래 사용했다.	새 비누를 구입했다.	1
1690	1691	여자는 10년 이상 기타를 배웠다.	결과	여자는 기타 연주를 잘한다.	여자는 기타 연주를 할 줄 모른다.	1
1691	1692	아이와 함께 식당에 들어갔다.	결과	직원이 유아용 의자를 가져다주었다.	아이가 의자를 만들었다.	1
1692	1693	누나는 학교에 결석했다. 	원인	누나가 배탈이 났다. 	선생님이 누나를 칭찬하셨다.	1
1693	1694	미아 신고를 했다.	결과	아이가 실종되었다.	아이가 실족했다.	1
1694	1695	생선에서 썩은 내가 난다.	원인	생선이 신선하다.	생선이 부패했다.	2
1695	1696	여자가 더위 때문에 땀을 흘린다.	원인	여자가 많은 조명 아래 서 있다.	여자가 반사판으로 얼굴을 밝혔다.	1
1696	1697	벽에 페인트 칠을 했다.	결과	페인트를 새로 샀다.	벽에 있던 얼룩이 사라졌다.	2
1697	1698	어제 체육관에서 운동을 했다.	결과	목이 아프다.	근육통이 생겼다.	2
1698	1699	아이가 쥐고 있던 풍선 끈을 놓쳤다.	결과	풍선의 바람이 빠졌다.	풍선이 하늘 위로 날라갔다.	2
1699	1700	길을 걷다가 미끄러졌다.	원인	비가 와서 땅이 젖었다	비가 와서 집에서 머물렀다.	1
1700	1701	하늘에서 우연히 오로라를 발견했다.	원인	북극에 와 있다.	하와이에 와 있다.	1
1701	1702	더 많은 버스가 운행되기 시작했다.	원인	버스를 아무도 이용하지 않는다.	버스 이용객이 늘어났다.	2
1702	1703	창문을 닫았다.	원인	밖에서 시끄러운 소리가 들린다.	밖이 조용하다.	1
1703	1704	화초에 물을 주었다.	결과	화초가 싱싱해졌다.	화초 분갈이를 했다.	1
1704	1705	남자가 시장에 갔다.	결과	쯔유를 샀다.	쯔유를 만들었다.	1
1705	1706	휴대폰 전원이 꺼졌다. 	원인	휴대폰이 방전됐다.  	휴대폰 광고를 보았다.	1
1706	1707	선풍기를 틀었다.	결과	바람이 멈췄다.	바람이 느껴졌다.	2
1707	1708	메모지를 잘 보이는 곳에 붙였다.	원인	메모 내용을 잘 기억하고 싶었다.	메모 내용은 중요하지 않았다.	1
1708	1709	불이 났다.	결과	소방차를 부른다.	경찰차를 부른다.	1
1709	1710	무릎이 아팠다.	원인	오랫동안 누워 있었다.	계단을 여러 번 오르락 내리락 했다.	2
1710	1711	여성이 비만 판정을 받았다.	원인	여성이 패스트푸드를 자주 먹었다.	여성이 채소를 자주 먹었다.	1
1711	1712	아이를 잃어버렸다.	원인	길거리에 사람이 너무 많았다.	길거리가 한적했다.	1
1712	1713	도시에 핵폭탄이 떨어졌다.	결과	도시가 폐허가 되었다.	도시가 재개발되었다.	1
1713	1714	큰 소리로 웃었다.	원인	재미있는 이야기를 들었다.	화가 나는 이야기를 들었다.	1
1714	1715	의자의 다리가 부러졌다.	결과	의자가 쓰러졌다.	의자 위에 짐을 올려놓았다.	1
1715	1716	무거운 짐을 다 보관했다.	결과	어깨가 아프다.	몸이 가벼워졌다.	2
1716	1717	비가 며칠동안 오지 않았다.	결과	목이 마르다.	잔디가 시들시들해졌다.	2
1717	1718	선크림을 덧발랐다.	결과	피부가 타지 않았다.	피부가 탔다.	1
1718	1719	커튼을 끈으로 묶어 고정했다.	결과	방에 빛이 잘 들어왔다.	방에 빛이 잘 들어오지 않았다.	1
1719	1720	복사기로 문서를 복사했다.	결과	문서가 여러 장이 되었다.	문서가 찢어졌다.	1
1720	1721	호텔 방에 불이 켜지지 않았다.	원인	카드키를 방에 꽂지 않았다.	카드키를 방에 꽂았다.	1
1721	1722	한 달 만에 몸무게가 5kg이나 늘었다.	원인	매일 밤 야식을 먹었다.	매일 밤 운동을 했다.	1
1722	1723	남자가 재채기를 했다.	원인	남자의 코에 먼지가 들어갔다.	남자의 발에 먼지가 붙었다.	1
