	ID	sentence	question	1	2	answer
3012	3013	여자가 법학전문대학원에 진학하였다.	결과	여자가 변호사가 되었다.	여자가 의사가 되었다.	1
3013	3014	물린 곳이 가려워 긁고 있다.	원인	모기를 잡았다.	모기에 물렸다.	2
3014	3015	내가 신문에 등장했다.	원인	수능에서 만점을 받았다.	집에서 영화를 봤다.	1
3015	3016	여자가 고양이 사료를 샀다.	원인	여자는 개를 키우고 있다.	여자는 고양이를 키우고 있다.	2
3016	3017	횡단보도의 신호등이 파란 불로 바뀌었다.	결과	사람들이 길을 건너기 시작했다.	사람들이 길을 건너지 않는다.	1
3017	3018	피부가 탔다.	원인	선크림을 바르지 않았다.	선글라스를 쓰지 않았다.	1
3018	3019	놀이공원에 사람이 많다.	결과	놀이공원이 집에서 멀다.	놀이공원에 들어가지 못했다.	2
3019	3020	풍선에 헬륨 가스를 넣었다.	결과	풍선이 바닥에 가라앉는다.	풍선이 공중에 뜬다.	2
3020	3021	손전등의 불이 들어오지 않는다.	결과	손전등의 배터리를 교체했다.	손전등을 캠핑 준비물로 챙겼다.	1
3021	3022	좋아하는 노래가 TV에서 나온다.	결과	양손으로 귀를 막는다.	따라서 흥얼거린다	2
3022	3023	물컵을 쓰러뜨렸다.	결과	바닥에 물이 엎질러졌다.	바닥에 물을 뿌렸다.	1
3023	3024	옥수수를 받았다.	결과	옥수수를 쪘다.	감자를 쪘다.	1
3024	3025	여자의 입술이 부어올랐다.	원인	여자는 매운 음식을 먹었다.	여자는 사탕을 먹었다.	1
3025	3026	고기를 양념에 재었다.	결과	고기가 싱겁다.	고기에 양념이 배었다.	2
3026	3027	여자가 손으로 부채질을 한다.	원인	날씨가 매우 덥다.	날씨가 매우 춥다.	1
3027	3028	서류가 인정되지 않았다.	원인	서류에 직인을 찍었다.	서류에 직인을 찍지 않았다.	2
3028	3029	자고 있는 친구의 얼굴에 물을 뿌렸다.	결과	친구가 코를 골았다.	친구가 일어났다.	2
3029	3030	머리카락이 찰랑거린다.	원인	머리카락을 이틀 동안 빗지 않았다.	머리카락에 영양제를 발랐다.	2
3030	3031	바닥에 얼룩이 묻었다.	결과	바닥에 있는 얼룩을 닦았다.	바닥에 흙이 묻어 있다.	1
3031	3032	아이의 이빨이 비뚤게 자랐다.	결과	치아 교정이 필요없다.	치아 교정을 시작했다.	2
3032	3033	남성은 휴대폰을 물에 빠트렸다.	결과	남성의 휴대폰에서 진동이 울린다.	남성의 휴대폰이 고장났다.	2
3033	3034	곡예사가 저글링을 한다.	결과	관중들이 환호한다.	곡예사가 공중에서 추락한다.	1
3034	3035	남성이 복부비만 판정 받았다.	원인	남성이 폭식을 했다.	남성이 거식증에 걸렸다.	1
3035	3036	그는 선풍기를 껐다.	원인	더 이상 덥지 않다.	너무 더워 잠을 잘 수가 없다.	1
3036	3037	여자가 남성과 결혼하였다.	원인	여자는 동성애자다.	여자는 동성애자가 아니다.	2
3037	3038	컵 속의 음료수가 시원해졌다.	원인	음료수를 전자레인지에 데웠다.	음료수에 얼음을 넣었다.	2
3038	3039	국회의원이 정치적으로 잘못된 발언을 했다.	원인	국회의원은 청중을 지루하게 했다.	국회의원은 청중을 분노하게 했다.	2
3039	3040	남자는 잘못을 빌었다.	원인	남자는 큰 실수를 했다.	남자는 일을 성공적으로 마쳤다.	1
3040	3041	최종 면접에 합격했다.	결과	취업준비생이 되었다.	입사에 성공했다.	2
3041	3042	여자가 얼음을 씹어 먹었다.	결과	여자의 이가 시리다.	여자의 혀가 뜨겁다.	1
3042	3043	선생님께 꾸짖음을 들었다.	원인	친구와 싸웠다.	숙제를 다 했다.	1
3043	3044	남자가 허리를 다쳤다.	결과	남자는 정신과 의사를 만나러 갔다.	남자는 하루종일 침대에 누워 있었다.	2
3044	3045	여자가 탐폰을 샀다.	원인	여자의 생리가 시작되었다.	여자의 생리가 끝났다.	1
3045	3046	자동차를 정비소에 맡겼다.	원인	자동차를 새로 뽑았다.	자동차가 고장났다.	2
3046	3047	엄마가 아이와 눈높이를 맞추었다.	원인	엄마가 쭈그려 앉았다.	엄마가 일어섰다.	1
3047	3048	남자는 비를 맞았다.	원인	남자는 우산을 구매했다.	남자는 우산을 두고 나왔다.	2
3048	3049	길을 잃어버렸다.	결과	여자가 지도를 가지고 오지 않았다.	지도 어플로 길을 찾았다.	2
3049	3050	새우를 기름에 볶았다.	결과	새우가 회색이 되었다.	새우가 분홍색이 되었다.	2
3050	3051	남자가 올림픽 양궁 종목에서 전체 1등을 하였다.	결과	올림픽 주최국은 남자에게 은메달을 수여하였다.	올림픽 주최국은 남자에게 금메달을 수여하였다.	2
3051	3052	사격 게임을 했다.	결과	과녁을 다 맞췄다.	화살을 모두 사용했다.	1
3052	3053	다 마르지 않은 물감을 손으로 문질렀다.	결과	물감이 번졌다.	물감을 팔레트에 짰다.	1
3053	3054	칼에 손을 베였다.	결과	영양제를 먹는다.	반창고를 붙인다.	2
3054	3055	동생이 아직 집에 들어오지 않았다.	원인	동생은 방에서 게임을 하고 있다.	동생은 심부름을 갔다.	2
3055	3056	지하철에 사람이 매우 많다.	원인	출근시간대이다.	심야시간대이다.	1
3056	3057	소년이 식탁에 발을 올렸다.	결과	소년의 아버지가 식탁에 앉았다.	소년의 아버지가 소년을 나무랐다.	2
3057	3058	그 여자는 어머니에게 기업을 물려받았다.	원인	그 여자의 아버지는 백만장자였다.	그 여자의 어머니는 기업의 총수였다.	2
3058	3059	꿈에 귀신이 나왔다.	원인	로맨스 영화를 보고 잤다.	공포영화를 보고 잤다.	2
3059	3060	잠자리에 들었다.	원인	아침이 되었다.	늦은 밤이 되었다.	2
3060	3061	남성의 발이 무좀균에 감염되었다.	결과	남성이 무좀에 걸렸다.	남성이 감기에 걸렸다.	1
3061	3062	아이는 튜브에 몸을 의지했다.	원인	아이는 수영을 못했다.	아이는 수영을 잘했다.	1
3062	3063	아기의 기저귀를 제때 갈아주지 않았다.	결과	아기가 잠에 들었다.	아기가 운다.	2
3063	3064	얼음을 믹서기로 갈았다.	결과	얼음이 딱딱해졌다.	얼음이 쪼개졌다.	2
3064	3065	쌀을 밥솥에 안쳤다.	결과	쌀이 국이 되었다.	쌀이 밥이 되었다.	2
3065	3066	청소기를 사용했다.	결과	바닥이 깨끗해졌다.	바닥에 먼지가 많다.	1
3066	3067	칼질을 하다가 실수로 손을 베었다.	결과	손에 약을 발랐다.	손에서 냄새가 난다.	1
3067	3068	충치가 생겼다.	원인	양치를 잘 했다.	양치를 잘 하지 않았다.	2
3068	3069	손가락에 반지가 꼈다.	결과	손가락이 부어오른다.	손톱을 깎는다.	1
3069	3070	할머니께서 세뱃돈을 주셨다. 	원인	할머니께서 돌아가셨다. 	할머니께 세배를 드렸다. 	2
3070	3071	여자의 몸이 튼튼해졌다.	원인	여자가 알약을 꾸준히 먹었다.	여자가 밤을 샜다.	1
3071	3072	포스터에 잉크가 번졌다.	원인	잉크가 마를 때까지 기다렸다.	포스터에 물을 쏟았다.	2
3072	3073	햄버거를 먹는데 목이 막힌다.	결과	콜라를 마신다.	콜라를 바닥에 버린다.	1
3073	3074	손이 끈적거린다.	원인	손에 물을 쏟았다.	손에 사이다를 쏟았다.	2
3074	3075	아이가 아버지보다 키가 커졌다.	원인 	아이가 성장기를 겪었다.	아이가 살이 쪘다.	1
3075	3076	계약직으로 일하던 남성은 퇴사했다.	원인	계약을 연장했다.	계약이 종료되었다.	2
3076	3077	목이 마르다.	원인	물을 마시지 못했다.	텀블러를 샀다.	1
3077	3078	노래를 오랫동안 불렀다.	결과	목이 아프다.	노래방이 폐업했다.	1
3078	3079	사람들이 일제히 함성을 지른다.	원인	우리나라 축구팀이 골을 넣었다.	우리나라 축구팀이 경기에서 패배했다.	2
3079	3080	가수의 목이 쉬었다.	원인	가수가 3시간 동안 춤을 추었다.	가수가 3시간 동안 노래를 불렀다.	2
0	3081	이퀄라이저는베이스 스캔의 사운드를 올렸습니다.	결과	베이스 소리가 잘 들리게 되었다.	베이스 소리가 들리지 않게 되었다.	1
1	3082	나는 음료에 초콜릿 시럽을 넣었다.	결과	음료수가 더 달아졌다.	음료수가 차가워졌다.	1
2	3083	그 남자는 호수에 휴대 전화를 넣었습니다.	결과	휴대폰이 업그레이드 되었다.	휴대폰이 고장났다.	2
3	3084	집 옆에있는 사람이 나갔다.	원인	옆 집 사람은 계약이 완료되었다.	옆 집 사람은 계약을 연장했다.	1
4	3085	나는 문을 밀었다.	결과	문이 잠겼다.	문이 열렸다.	2
5	3086	산은 녹았다.	결과	지구의 기온이 내려갔다.	지구의 기온이 올라갔다.	2
6	3087	케이크 불타는 촛불입니다.	결과	촛불이 꺼졌다.	촛불이 활활 타오른다.	1
7	3088	나는 검은 색 선글라스를 썼다.	원인	밖이 아주 어두웠다	햇빛이 너무 강했다	2
8	3089	여성들은 다이빙 밴드에서 뛰어 올랐습니다.	결과	여성은 수영장에 빠졌다.	여성은 다이빙대로 달렸다.	1
9	3090	소녀의 얼굴이 창백 해졌습니다.	원인	소녀가 강아지와 함께 놀았다.	소녀가 무서운 영화를 봤다.	2
10	3091	나는 이불에 커피를 부어 냈다.	결과	커피가 시원해졌다.	이불이 젖었다.	2
11	3092	욕조는 내려 가지 않습니다.	원인	배수구 고무 마개를 뽑았다.	배수구 고무 마개를 뽑지 않았다.	2
12	3093	학생이 규칙을 망 쳤어.	결과	학생은 선생님께 칭찬을 받았다.	학생은 선생님께 꾸중을 들었다.	2
13	3094	그 남자가 홍보되었습니다.	원인	남자가 불성실하다.	남자가 큰 프로젝트를 성공시켰다.	2
14	3095	그는 의지를 떠났습니다.	원인	그의 아내가 사망했다.	그는 죽음을 앞두고 있다.	2
15	3096	군대는 항복했다.	원인	그 군대가 수적으로 열세였다.	그 군대가 도시를 점령했다.	1
16	3097	한 남자가 공황 공격을 일으켰습니다.	원인	남자가 공황장애를 앓고 있다.	남자가 감기에 걸렸다.	1
17	3098	캠프에 온 학생들은 무서워했습니다.	원인	캠프 교관이 귀신 이야기를 했다.	캠프파이어에서 마시멜로를 구워먹었다.	1
18	3099	나는 스피커 근처 마이크를 가져 왔습니다.	결과	스피커에서 아무런 소리도 나지 않는다.	소름끼치게 큰 소리가 울려퍼진다.	2
19	3100	한 여자는 남성을 경찰에보고했습니다.	원인	남성이 경찰차에서 내렸다.	여성이 남성의 범죄현장을 목격했다.	2
20	3101	나는 여과 지퍼를 열었다.	결과	지익 소리가 난다.	아무 소리도 나지 않는다.	1
21	3102	나는 스팀처에 만두를 넣었다.	결과	만두를 빚었다.	만두가 익었다.	2
22	3103	여자는 전기 자동차에 연결됩니다.	결과	전기차가 충전되었다.	전기차가 방전되었다.	1
23	3104	딸은 알레르기 성 발작을 야기했습니다.	결과	딸을 응급실에 데려갔다.	딸을 재웠다.	1
24	3105	나는 철 십대에 물건을 넣었다.	결과	케이스가 흔들릴 때마다 요란한 소리가 난다.	캐이스 안에 물건을 마음껏 담을 수 있다.	1
25	3106	나는 마트에서 할인 쿠폰을 사용했습니다.	결과	물건을 판매가보다 싼 값에 구입했다.	물건을 판매가보다 비싼 값에 구입했다.	1
26	3107	그 여자는 옷장을 열었습니다.	결과	여자가 신발을 꺼냈다.	여자가 코트를 꺼냈다.	2
27	3108	아기가 잠들었습니다.	원인	아빠가 아이를 안고 토닥거렸다.	아빠가 아이에게 밥을 먹였다.	1
28	3109	초밥의 매운 맛은 심각했습니다.	원인	초밥에 와사비가 많이 들어갔다.	초밥에 와사비가 적게 들어갔다.	1
29	3110	ATM에서 현금 인출 버튼을 누릅니다.	결과	투입구에서 지폐가 나왔다.	지폐를 투입구에 넣었다.	1
30	3111	자전거 바퀴가 묻혔습니다.	결과	자전거 바퀴에 공기를 넣었다.	자전거 바퀴를 교체했다.	2
31	3112	그녀는 입을 열었습니다.	원인	조개를 석쇠에 구웠다.	조개를 물에서 꺼냈다.	1
32	3113	나는 롯지에 물고기를 다듬었다.	결과	도마에서 오이 냄새가 난다.	도마에서 생선 냄새가 난다.	2
33	3114	나는 하이힐을 착용하고 있습니다.	결과	키가 작아졌다.	키가 커졌다.	2
34	3115	팔에 혈액.	원인	고양이가 할퀴었다.	파리가 팔에 앉았다.	1
35	3116	아이들은 한복을 착용했습니다.	원인	오늘은 설날이다.	오늘은 아이의 생일이다.	1
36	3117	그 여자는 심호흡을했습니다.	결과	여자가 긴장했다.	여자의 긴장이 풀렸다.	2
37	3118	구름이 하늘에있었습니다.	결과	여자는 양산을 펼쳤다.	여자는 집에 우산을 가지러 갔다.	2
38	3119	선호도의 바이올린 성능 능력이 증가했습니다.	원인	선호가 바이올린 연습을 하지 않았다.	선호가 바이올린 연습을 열심히 했다.	2
39	3120	스파게티 코튼, 오일, 마늘.	결과	알리오올리오가 완성되었다.	로제파스타가 완성되었다.	1
40	3121	녹은 얼음 팩을 냉동고에 넣었습니다.	결과	아이스팩이 미지근해졌다.	아이스팩이 얼었다.	2
41	3122	여성들은 치실을 사용했습니다.	원인	여성은 이를 치료하고자 한다.	여성의 이에 음식물이 꼈다.	2
42	3123	남성이 유명 해졌다.	결과	남성의 인스타그램 팔로워 수가 늘어났다.	남성의 인스타그램 팔로워 수가 줄어들었다.	1
43	3124	주전자의 물이 끓기 시작했습니다.	결과	주전자가 차가워졌다.	주전자에서 수증기가 나온다.	2
44	3125	나는 손톱을 자른다.	원인	손톱이 길어졌다.	손톱이 짧아졌다.	1
45	3126	여드름이 묻혔다.	원인	여드름에  힘을 가했다.	여드름 위에 연고를 발랐다.	1
46	3127	끓는 물에 넣으십시오.	결과	작두콩이 우려져, 작두콩 차가 되었다.	작두콩이 딱딱하게 굳었다.	1
47	3128	그는 감옥에 갔다.	원인	그는 착한일을 많이 했다.	그는 범죄를 저질렀다.	2
48	3129	Kitchentaol과 가스 범위를 닦으십시오.	원인	가스레인지 주변에 기름이 많이 튀었다.	가스레인지에 물을 올렸다.	1
49	3130	그 소녀의 아버지는 그 소녀를 제자리 짓는다.	원인	소녀가 소녀의 아버지에게 존댓말을 했다.	소녀가 소녀의 아버지에게 거짓말을 했다.	2
50	3131	나는 버스를 놓쳤다.	결과	약속장소에 늦게 도착했다.	교통비가 모자라다.	1
51	3132	두 당사자는 모두 갈등 합의를 보았습니다.	원인	그들은 법정에서 담판을 짓고자 한다.	그들은 법정에서 논쟁하길 원치 않는다.	2
52	3133	나는 유선 전화 플러그를 뽑았다.	결과	전화가 걸리지 않는다.	전화가 걸린다.	1
53	3134	여성들은 발목에 염증이 있습니다.	결과	여성은 소염제를 먹었다.	여성은 뛰다가 발목을 접질렀다.	1
54	3135	안전 요원이 공포를 불어 넣기 시작했습니다.	원인	사람들이 위험 구역으로 접근했다.	사람들이 식사를 한다.	1
55	3136	나는 고추를 움켜 잡았다.	결과	고춧가루가 되었다.	후춧가루가 되었다.	1
56	3137	나는 늦게 잤다.	원인	알람 소리를 듣지 못했다.	일찍 잠자리에 들었다.	1
57	3138	아이는 트램폴린에 착륙했습니다.	결과	아이가 공중으로 다시 솟아올랐다.	아이의 머리에서 피가 났다.	1
58	3139	그 남자는 자전거를 도둑 맞았습니다.	원인	남자는 자전거를 집 안에 보관했다.	남자는 자전거에 자물쇠를 채우지 않았다.	2
59	3140	요리사가 그릇에 계란을 쳤습니다.	결과	계란 껍질이 갈라졌다.	계란이 썩었다.	1
60	3141	나는 내 귀에 피를 낳았다.	원인	귀에 염증이 생겼다.	귀에 물이 들어갔다.	1
61	3142	한 여성이 아이를줬고 소아과에 갔다.	결과	여자가 아프다.	아이가 아프다.	2
62	3143	여자는 강아지와 함께 걷고있다.	원인	여성은 식사를 한다.	여성은 반려동물을 키운다.	2
63	3144	나는 경찰에 남자를보고했다.	원인	나는 그 남자가 물건을 훔치는 것을 보았다.	나는 그 남자가 누군지 모른다.	1
64	3145	우유에 혼합 된 코코아 가루.	결과	코코아 가루가 우유와 분리되었다.	코코아가 만들어졌다.	2
65	3146	소년은 복숭아를 샀다.	결과	복숭아가 단단해진다.	복숭아의 즙이 터져나온다.	2
66	3147	나는 모기를 훈제했다.	원인	방에서 모기를 발견했다. 	밖에 나가려고 한다.	1
67	3148	그 여자는 매주 주말에 교회에 갔다.	원인	여자는 기독교 신자였다.	여자는 불교 신자였다.	1
68	3149	올림픽을 보는 사람들.	원인	국가대표 선수가 금메달을 획득했다.	국가대표 선수가 부상을 입었다.	1
69	3150	나는 잠자는 양말을 착용하고 있습니다.	원인	발이 시렵다.	손이 시렵다.	1
70	3151	그 남자는 콩고를 먹었습니다.	원인	남자가 채식주의를 하기로 마음 먹었다.	남자가 육식소비를 하기로 마음 먹었다.	1
71	3152	라디오의 볼륨은 볼륨을 줄였습니다.	원인	라디오에서 소리가 나오지 않는다.	라디오에서 소리가 크게 나온다.	2
72	3153	나는 욕실 벽에 곰팡이가있다.	결과	락스를 뿌렸다.	물을 뿌렸다.	1
73	3154	지갑에는 현금이 없습니다.	결과	백화점에 간다.	은행에 간다.	2
74	3155	그 남자는 직원들에게 병따개를 요청하도록 요청했습니다.	원인	남자는 맥주병의 뚜껑을 따려고 한다.	남자는 콜라 캔을 따려고 한다.	1
75	3156	나는 다시 본 영화를 보았다.	원인	영화관에서 팝콘을 먹었다.	그 영화가 재미있었다.	2
76	3157	양파가 투명해진다.	원인	양파를 볶았다.	양파를 수확했다.	1
77	3158	소방관들은 빠르게 땀을 흘리고있었습니다.	원인	절도 사건이 발생했다.	산불이 발생했다.	2
78	3159	그 남자는 기차역에서 일찍 도착했습니다.	결과	남자는 기차를 놓쳤다.	남자는 기차를 탔다.	2
79	3160	남성은 종이에 손이었습니다.	결과	남성은 종이를 잘랐다.	남성의 손에서 피가 난다.	2
80	3161	나는 몸 전체에서 땀을 흘린다.	원인	차가운 목욕탕에 들어갔다.	뜨거운 목욕탕에 들어갔다.	2
81	3162	행이 깨졌습니다.	결과	전기가 끊겼다.	전기 공급이 원활하게 이루어졌다.	1
82	3163	수컷은 기절했다.	원인	남성은 낮잠을 잤다.	남성은 마라톤을 완주했다.	2
83	3164	남자는 맨손으로 염산을 만졌다.	결과	남성의 손이 손상을 입었다.	남성의 손이 소독되었다.	1
84	3165	주말이 예상됩니다.	원인	주말에 삼촌 장례식에 간다.	주말에 친구 결혼식에 간다.	2
85	3166	커피가 가방에 묻혔습니다.	원인	커피를 쏟았다.	가방을 샀다.	1
86	3167	불법 주차가 감지되었습니다.	결과	과태료를 냈다.	주차장이 세워졌다.	1
87	3168	상점 표시등이 꺼져 있습니다.	원인	가게 영업 시간이 되었다.	가게 영업 시간이 종료되었다.	2
88	3169	신호등은 빨간 불입니다.	결과	도로에 차들이 쌩쌩 달린다.	도로의 차들이 멈추었다.	2
89	3170	저녁을 요리하는 것은 짜증이납니다.	결과	밥을 안치고 국을 끓였다.	음식을 배달시켰다.	2
90	3171	여성들은 휴가를 사용했습니다.	원인	여성은 친구와 여행을 가기로 했다.	여성은 처리해야 할 일이 많다.	1
91	3172	학생은 반사 문을 썼습니다.	원인	학생은 학급 규칙을 어겼다.	학생은 친구들과 사이가 좋다.	1
92	3173	나는 연필로 글쓰기를 썼다.	결과	연필심이 닳았다.	연필심이 늘어났다.	1
93	3174	초인종은 소리 쳤다.	원인	문을 열어 누가 왔는지 확인한다.	누군가 초인종을 눌렀다.	2
94	3175	물집이 여자의 손에 잡혔다.	원인	여자가 메시지를 입력했다.	여자가 밧줄을 올랐다.	2
95	3176	그 여자는 비명을 지르고 잠을 자고있었습니다.	원인	여자는 오늘 회사에 가지 않는다.	여자가 악몽을 꾸었다.	2
96	3177	노트북이 바닥에 떨어졌습니다.	결과	노트북 파우치를 구매했다.	노트북 화면에 금이 갔다.	2
97	3178	물은 끓는 것입니다.	결과	물의 온도는 50도보다 낮다.	물의 온도는 50도보다 높다.	2
98	3179	나는 경사로를 연주했다.	결과	숨이 찼다.	숨을 멈췄다.	2
99	3180	축구 팀은 결승에서 잃어 버렸습니다.	원인	선수들의 컨디션이 좋았다.	선수들의 컨디션이 좋지 않았다.	2
100	3181	나는 모기를 훈제했다.	원인	바닥에 기어다니는 바퀴벌레를 발견했다.	날아다니는 모기를 발견했다.	2
101	3182	욕조에 들어있는 물은 드레인으로 내려갑니다.	원인	배수구에 물마개를 끼웠다.	배수구의 물마개를 뽑았다.	2
102	3183	나는 자연사 박물관에 갔다.	결과	기념품을 샀다.	핸드폰을 바꿨다.	1
103	3184	나는 불법 이민자들에 의해 잡혔다.	결과	그들은 일자리를 구했다.	그들은 추방당했다.	2
104	3185	쓰레기가 거리에서 쫓겨납니다.	원인	사람들이 거리에 쓰레기를 함부로 버렸다.	환경 미화원이 거리의 쓰레기를 모두 주웠다.	1
105	3186	남편이 차를 뽑아 마트에 갔다.	원인	마트가 집 바로 앞에 있다.	마트가 집에서 멀리 있다.	2
106	3187	나는 아랍의 친구를 만들었습니다.	결과	스페인어를 배웠다.	아랍어를 배웠다.	2
107	3188	나는 볶음밥에 치즈를 돌았고 전자 레인지로 향했다.	결과	치즈가 녹았다.	치즈가 굳었다.	1
108	3189	나는 집에서 음식을 만들었습니다.	결과	설거지를 했다.	배가 고팠다.	1
109	3190	여성은 유리에 세척제를 뿌리칩니다.	원인	유리가 더럽다.	유리가 깨끗하다.	1
110	3191	날씨로 풍 화.	원인	화석연료를 더이상 사용하지 않는다.	지구온난화가 심각하게 진행되었다.	2
111	3192	나는 찹쌀 가루로 늘어났다.	결과	떡이 만들어졌다.	빵이 만들어졌다.	1
112	3193	나는지게 라인을 가져왔다.	원인	많은 양의 흙에 물을 주려고 한다.	많은 양의 흙을 파서 옮기려고 한다.	2
113	3194	아이는 바다에 갔다.	결과	아이는 숙제를 했다.	아이는 수영을 했다.	2
114	3195	YouTube에서 이미지 편집을 마쳤습니다.	결과	유튜브에 영상을 업로드 했다.	유튜브에서 음악을 다운로드 받았다.	1
115	3196	나는 올림픽 게임에서 은메달을 획득했습니다.	원인	올림픽에서 3위를 했다.	올림픽에서 2위를 했다.	2
116	3197	타고있는 배.	원인	암초에 부딪혔다.	배가 선착장에 도착했다.	1
117	3198	여성들은 음식을 주문했습니다.	원인	여성은 배가 아팠다.	여성은 배가 고팠다.	2
118	3199	남성은 사건의 과장에 관해 이야기합니다.	원인	남성은 부끄러워하고 있다.	남성은 관심을 받고 싶다.	2
119	3200	자동차가 물 웅덩이를 통과했습니다.	결과	물이 증발되었다.	물이 튀었다.	2
120	3201	그것은 저체온에서 잡혔습니다.	결과	더운 곳에서 에어컨 없이 가만히 있었다.	추운 곳에서 에어컨 없이 가만히 있었다.	2
121	3202	택시가 집 앞에 멈췄습니다.	원인	나는 콜택시를 불렀다.	나는 배달 주문을 했다.	1
122	3203	나는 칠판에 편지를 썼다.	결과	분필로 글자를 쓴다.	분필 지우개로 글자를 지운다.	2
123	3204	강아지가 걷기 위해 나갔다.	결과	강아지가 들꽃 냄새를 맡았다.	강아지가 잠을 잤다.	1
124	3205	사서함이 사서함에 쌓여 있습니다.	원인	나에게 편지를 보낸 사람이 없다.	최근에 우편함을 확인하지 않았다.	2
125	3206	더운 여름날, 비가 떨어졌습니다.	결과	주변이 시원해졌다.	주변이 뜨거워졌다.	1
126	3207	나는 조화에 물을주지 않았다.	결과	조화는 썩었다.	조화의 상태는 변화가 없다.	2
127	3208	나는 내 집을 태웠다.	원인	세면대 물을 틀어둔 채로 잊어버렸다.	가스 불을 켜둔 채로 잊어버렸다.	2
128	3209	온도는 매우 높습니다.	결과	얼음이 더 빨리 녹는다.	얼음이 더 천천히 녹는다.	1
129	3210	아이들은 집에서 뛰어입니다.	결과	아랫집에서 아이들이 뛰는 소리가 들린다.	앞집에서 아이들이 뛰는 소리가 들린다.	1
130	3211	드럼이 깨졌습니다.	결과	기타를 칠 수 없다.	드럼을 칠 수 없다.	2
131	3212	주말에 비가 내리고 있습니다.	결과	주말 약속을 취소했다.	주말에 출근했다.	1
132	3213	여자가 지사를 먹었습니다.	원인	여성은 설사때문에 고통받고 있다.	여성은 변비때문에 고통받고 있다.	1
133	3214	나는 몸에 바디 크림을 썼다.	결과	피부가 건조해졌다.	피부가 촉촉해졌다.	2
134	3215	치즈가 녹았다.	원인	치즈에 열을 가했다.	치즈를 냉동실에 넣었다.	1
135	3216	나는 자외선 차단제를 적용했다.	원인	자외선이 강하다.	비가 온다.	1
136	3217	커피에 배달이 적용됩니다.	결과	배달 온 커피를 마셨다.	커피를 사러 밖으로 나갔다.	1
