	ID	sentence	question	1	2	answer
1579	4660	나는 보트를 두려워합니다.	원인	아침을 까먹고 먹지 않았다.	아침을 배부르게 먹었다.	1
1580	4661	남자들은 식후의 혈당을 확인합니다.	원인	남성은 치매가 있다.	남성은 당뇨가 있다.	2
1581	4662	나는 마이크와 이야기한다.	결과	목소리가 크게 울린다.	목소리가 들리지 않는다.	1
1582	4663	나는 바늘로 풍선을 파열했다.	결과	풍선에서 큰 소리가 났다.	풍선이 커졌다.	1
1583	4664	나는 우유 차에 정액을 냄새 맡는다.	원인	밀크티를 버렸다.	밀크티가 상했다.	2
1584	4665	나는 동물원에 갔다.	결과	좋아하는 책을 봤다.	사자를 봤다.	2
1585	4666	그 여인은 상금을 받았습니다.	원인	여자는 대회에서 우승했다.	여자는 대회에 출전하지 않았다.	1
1586	4667	나는 배가 고팠다.	결과	비타민을 먹었다.	소화제를 먹었다.	2
1587	4668	여자는 오랫동안 철을 탔다.	결과	손에 물집이 잡혔다.	발에 물집이 잡혔다.	1
1588	4669	그레이트 도시의 밤 하늘에 많은 별들이 있습니다.	원인	대도시의 인구 수가 많다.	공기가 매우 맑은 날이다.	1
1589	4670	여자가 복권을 받았습니다.	원인	여자가 복권에 당첨되었다.	여자가 복권에 당첨되지 않았다.	1
1590	4671	알람 시계가 울리고 있습니다.	결과	알람을 맞추었다.	알람을 듣고 일어났다.	2
1591	4672	감독은 기호를 촬영하기 시작했습니다.	결과	배우가 연기를 시작했다.	배우가 연기를 마쳤다.	1
1592	4673	나는 텀블러를 가져 오지 않았다.	결과	밥을 먹지 못했다.	물을 마시지 못했다.	2
1593	4674	갑자기 나는 브레이크를 밟았다.	원인	길에서 고양이가 튀어나왔다. 	길 고양이를 집으로 데려왔다.	1
1594	4675	여성들은 현관 암호를 용서했습니다.	결과	여성은 비밀번호를 바꾼지 얼마 되지 않았다.	여성은 집에 들어가지 못했다.	2
1595	4676	나는 1 층에 사탕을 떨어 뜨렸다.	결과	사탕 주변으로 개미가 꼬였다.	사탕 주변에 물이 생겼다.	1
1596	4677	고무 밴드를 뽑았습니다.	결과	고무줄이 날라갔다.	고무줄이 늘어났다.	2
1597	4678	휴대 전화는 젖었지만 나는 그것을 깰하지 않았다.	원인	휴대폰은 방수 기능이 없다.	휴대폰에 방수 기능이 있다.	2
1598	4679	그 남자는 뒷문으로 건물을 나왔습니다.	원인	정문이 폐쇄되었다.	정문이 열려있었다.	1
1599	4680	그 남자는 의무에 걸친 것입니다.	결과	남자는 노래를 불렀다.	남자는 자주 메모했다.	2
1600	4681	멀리 떨어지는 것이 있습니다.	원인	오늘은 제헌절이다.	오늘은 개천절이다.	2
1601	4682	그의 머리를 감지하지 못한 남자가 나가려고 노력하고 있습니다.	결과	남자가 목도리를 둘렀다.	남자가 모자를 썼다.	2
1602	4683	운동 중에 나는 이온 음료를 마셨다.	원인	목이 마르다.	허리가 아프다	1
1603	4684	그는 그가 해고 당했다고 말했다.	결과	숨쉬기가 편해졌다.	숨쉬기가 불편해졌다.	2
1604	4685	그 남자는 국가의 자리로 지정되었습니다.	원인	남자는 국가에 헌신했다.	남자는 국가를 배신했다.	1
1605	4686	남자는 자외선 차단제를 적용합니다.	원인	남성은 그늘에 앉아 있을 예정이다.	남성은 해변에 나갈 예정이다.	2
1606	4687	나는 급여를 받았다.	원인	쇼핑을 신나게 했다.	일을 열심히 했다.	2
1607	4688	나는 옷장에 탈구 제를 넣었다.	결과	옷장 속의 습기가 사라졌다.	옷장 속의 습기가 증가했다.	1
1608	4689	발목 인대가 증가했습니다.	결과	발에 깁스를 했다.	발에 반창고를 붙였다.	1
1609	4690	화이트 보드에 분필로 편지를 썼습니다.	결과	글자가 선명하게 적혔다.	글자가 잘 적히지 않았다.	2
1610	4691	아이의 목이 쉬었다.	원인	아이가 조용한 목소리로 이야기를 많이 했다.	아이가 소리를 많이 질렀다.	2
1611	4692	이어폰에 소리가 나오지 않습니다.	원인	이어폰이 제대로 꽂히지 않았다.	이어폰을 새로 구입했다.	1
1612	4693	암호를 잘못 입력했습니다.	결과	로그인이 되었다.	로그인이 되지 않는다.	2
1613	4694	교사는 학생을 칭찬했습니다.	원인	학생이 질문에 올바르게 답을 했다.	학생이 선생님에게 욕을 했다.	1
1614	4695	계산 소스는 카운터의 금전 등록부를 열었습니다.	원인	손님이 신용카드를 내밀었다.	손님이 현금을 내밀었다.	2
1615	4696	하수도의 큰 부분이 하수구에 들어갔다.	결과	하수구가 막힌다.	하수구가 뚫린다.	1
1616	4697	아이가 하품을하고 있습니다.	원인	아이는 졸리다.	아이는 놀랐다.	1
1617	4698	모래는 껍질에서 씹었습니다.	원인	조개 해감을 제대로 시켰다.	조개 해감이 제대로 되지 않았다.	2
1618	4699	세탁물은 잘 건조하지 않습니다.	원인	하루종일 비가 온다.	하루종일 해가 쨍쨍하다.	1
1619	4700	상처를 소독합니다.	결과	상처가 오염됐다.	상처가 깨끗해졌다.	2
1620	4701	직원들은 객실에 가이드 여성이 있습니다.	원인	한 여성이 직원에게 객실이 어디인지 물어봤다.	여성이 직원에게 키를 반납했다.	1
1621	4702	대통령은 직원을 보았습니다.	원인	사장은 직원이 한 일이 마음에 든다.	사장은 직원이 한 일이 마음에 들지 않는다.	2
1622	4703	그 남자는 다리에 깁스가있었습니다.	원인	남자는 다리가 부러졌다.	남자는 다리털을 밀었다.	1
1623	4704	잡초는 마당에서 침묵 해졌습니다.	원인	여름이 되었다.	겨울이 되었다.	1
1624	4705	나는 물을 쌀에 넣고 먹기 위해 갔다.	결과	벼루 안의 물이 투명해졌다.	먹물이 만들어졌다.	2
1625	4706	나는 침구에 어부들을 뿌렸다.	결과	침구에서 악취가 난다.	침구에서 좋은 향기가 난다.	2
1626	4707	나는 더러운 손으로 눈을 문지른다.	결과	눈병이 생긴다.	눈이 감긴다.	1
1627	4708	선수들은 겨울 훈련을 남겼습니다.	결과	선수들의 기량이 높아졌다.	선수들의 키가 커졌다.	1
1628	4709	나는 티켓을 지루했다.	결과	딱지가 있던 자리에서 피가 난다.	딱지가 있던 자리에서 땀이 난다.	1
1629	4710	나는 불쾌하다.	원인	모르는 여자가 나를 째려본다.	제일 친한 친구가 나에게 말을 걸었다.	1
1630	4711	강아지는 오랫동안 주인을 만났습니다.	결과	강아지가 꼬리를 흔든다.	강아지가 짖는다.	1
1631	4712	토끼의 귀가 길어집니다.	원인	토끼가 병원에서 마취제를 맞고 잠들었다.	토끼가 어떤 소리를 포착했다.	2
1632	4713	여자는 눈 주위에 고양이의 눈을 닦았습니다.	원인	고양이의 코에 코딱지가 끼었다.	고양이의 눈에 눈곱이 끼었다.	2
1633	4714	아이가 거리에서 울고 있습니다.	원인	아이는 장난감을 받았다.	아이는 길을 잃어버렸다.	2
1634	4715	그 남자는 긴장을 풀기가 어려웠습니다.	결과	남자가 수수께끼를 풀었다.	남자는 힌트를 요청했다.	2
1635	4716	눈이 빛났다.	원인	오랫동안 컴퓨터 게임을 했다. 	부루마블을 했다.	1
1636	4717	나는 내 눈에 맞았다.	결과	눈이 부어 앞이 보이지 않는다.	눈의 붓기가 빠져 앞지 잘 보인다.	1
1637	4718	나는 핸드 크림을 적용했다.	원인	손이 건조하다.	손에서 향기가 난다.	1
1638	4719	나는 거실에 나무를 설치했다.	원인	크리스마스가 다가 왔다.	발렌타인데이가 다가 왔다.	1
1639	4720	나는 갑각류를 주었다.	원인	등산을 갔다.	바다에 갔다.	2
1640	4721	나는 대기 테이블을 뽑았다.	원인	차례를 기다리는 사람이 많다.	차례를 기다리는 사람이 적다.	1
1641	4722	우리 팀은 집 뛰기를 연주했습니다.	원인	우리팀 관객이 실망했다.	우리팀 관객이 신나서 응원가를 불렀다.	2
1642	4723	나는 냉동실에서 얼음을 지켰다.	결과	얼음이 녹았다.	얼음이 녹지 않았다.	2
1643	4724	나는 세탁기에서 완성 된 옷을 꺼냈다.	결과	옷이 더러워졌다.	옷을 햇볕이 잘 드는 빨래 건조대에 널었다.	2
1644	4725	그 남자는 근육질 덕트에서 가질되었다.	결과	남자의 근육통이 심해졌다.	남자의 근육통이 완화되었다.	2
1645	4726	감독은 총격 사건의 촬영 끝을 날아갔습니다.	원인	감독이 원하는 장면을 모두 촬영했다.	감독이 원하는 장면을 아직 촬영하지 못했다.	1
1646	4727	아이들은 고아원에게 보냈습니다.	원인	아이들의 부모님이 아프다.	아이들의 부모님이 돌아가셨다.	2
1647	4728	그 여인은 옛날을 입었습니다.	원인	여자의 가족이 결혼한다.	여자의 가족이 죽었다.	2
1648	4729	팬은 날개를 씻고 있습니다.	원인	선풍기 바람이 강해졌다.	선풍기를 오랫동안 사용하지 않았다.	2
1649	4730	그 남자는 내일 일하지 않습니다.	원인	내일은 월요일이다.	내일은 공휴일이다.	2
1650	4731	그는 연필에 연필을 넣고 그것을 돌 렸습니다.	결과	연필이 뭉툭해졌다.	연필이 뾰족하게 깎였다.	2
1651	4732	그것은 면봉에 묻혔습니다.	원인	면봉으로 귀를 팠다.	귀이개로 귀를 팠다.	1
1652	4733	나는 휴대 전화를 떨어 뜨렸다.	결과	폰 액정이 깨졌다.	전화를 오랫동안 했다.	1
1653	4734	여성들은 모기에서 물렸다.	결과	여성은 가려움을 느낀다.	여성은 피곤함을 느낀다.	1
1654	4735	발한.	원인	냉탕에 들어갔다.	더운 사우나에서 찜질을 했다.	2
1655	4736	나는 시험을 망쳤다.	원인	밤새 게임을 했다.	문제집을 다 풀었다.	1
1656	4737	건물 주차장이 비어있었습니다.	결과	길 건너편에 주차했다.	주차장에 주차했다.	2
1657	4738	나는 중고차를 샀다.	결과	차가 금방 망가졌다.	차를 잃어버렸다.	1
1658	4739	손가락에 반지.	결과	손가락이 부었다.	손가락이 잘 움직인다.	1
1659	4740	아이가 부츠를 입고있었습니다.	원인	아이가 밖으로 나가려고 한다.	아이가 집으로 들어오려고 한다.	1
1660	4741	그 남자는 군중에서 눈에 띄었습니다.	원인	남자가 배낭을 메고 있었다.	남자가 네온 조끼를 입고 있었다.	2
1661	4742	열차가 속도를 줄였습니다.	원인	기차가 역에 접근하는 중이었다.	기차가 연착되었다.	1
1662	4743	나는 부동산 인증 대리인 사무실 사무실에 갔다.	원인	자취방을 알아보려고 한다.	자취방 청소를 했다.	1
1663	4744	비닐 봉투가 찢어졌습니다.	원인	봉투에 날카롭고 무거운 물건이 들어있었다.	봉투에 가벼운 물건이 들어있었다.	1
1664	4745	친구들은 보드 게임 진행 상황에 대해 설명했습니다.	결과	나는 보드게임 하는 법을 배웠다.	나는 보드게임 하는 법을 모른다.	1
1665	4746	바다는 깨끗했습니다.	원인	해수욕장을 몇 년간 봉쇄했다.	피서객들이 바다에 많이 들렀다.	1
1666	4747	분기가 끊어졌습니다.	원인	나뭇가지를 힘주어 잡아당겼다.	나뭇가지에 물을 뿌렸다.	1
1667	4748	어깨에 냉각.	원인	어깨에 상처가 있다.	어깨 근육이 뭉쳐 아프다.	2
1668	4749	가게는 개조 건설을 마쳤습니다.	결과	가게가 다시 오픈했다.	가게가 폐업했다.	1
1669	4750	노인들은 방어로 고통 받고있었습니다.	결과	노인의 아들이 파티를 위해 방문했다.	노인의 아들이 간병을 위해 방문했다.	2
1670	4751	환자는 의식이 없게되었습니다.	원인	환자가 마음의 병이 생겼다.	환자가 뇌졸중으로 쓰러졌다.	2
1671	4752	나는 그 감각을 벗겨지는 것에 지쳤다.	결과	곶감이 만들어졌다.	감미료가 만들어졌다.	1
1672	4753	거실은 바닥에 떨어졌습니다.	원인	거실 바닥이 미끄럽다.	거실 바닥이 차다.	1
1673	4754	나는 내 동생에게 사과했다.	원인	동생의 이불을 정리했다.	동생의 이불에 커피를 쏟았다.	2
1674	4755	아이가 새롭게 안경을 놓았습니다.	원인	아이의 시력이 나빠졌다.	아이의 시력이 좋아졌다.	1
1675	4756	나는 커플 링을 던졌다.	원인	연인이 싸웠다.	연인이 데이트를 했다.	1
1676	4757	도라지는 끓는 물에 넣었습니다.	결과	도라지가 물에 우려져, 도라지물이 완성되었다.	도라지가 딱딱하게 굳었다.	1
1677	4758	자전거가 임대되었습니다.	원인	자전거를 가져오지 않았다.	자전거를 새로 샀다.	1
1678	4759	남자들은 도서관에서 책을 빌릴 수 없습니다.	원인	남성은 반납하지 않은 책이 있다.	남성은 운동을 했다.	1
1679	4760	아버지는 아들의 알코올 중독에서 저널링되었습니다.	결과	아버지는 아들을 집에서 내보냈다.	아버지는 아들에게 맥주를 사줬다.	1
1680	4761	도로가 떨어지고 있었다.	원인	신발을 갈아신었다.	돌부리에 발이 걸렸다.	2
1681	4762	그 남자는 집에 간다.	원인	남자는 퇴근했다.	남자는 출근했다.	1
1682	4763	나는 일주일 내내 무거워졌습니다.	결과	강이 범람하고 홍수가 났다.	가뭄이 들어서 강이 메말랐다.	1
1683	4764	나는 연필을 자른다.	원인	연필이 날카롭다.	연필이 부러졌다.	2
1684	4765	여자는 놀이 단계에서 울고 묻혀있었습니다.	원인	여자는 무대 공포증이 있다.	여자는 연극 대사를 잘 외웠다.	1
1685	4766	나는 내 동생에게 랩톱을 빌 렸습니다.	원인	동생의 컴퓨터가 고장났다.	동생이 컴퓨터를 선물받았다.	1
1686	4767	나사를 스크류 드라이버로 나사로 망쳐 놓았습니다.	원인	의자 다리가 흔들거렸다.	의자 다리가 흔들리지 않는다.	1
1687	4768	나는 점심을 먹었다.	원인	시간이 촉박했다.	시간이 여유로웠다.	1
1688	4769	그 남자는 향수 병에 잡혔습니다.	원인	남자는 동생과 말 다툼을 했다.	남자는 3년째 외국에서 거주 중이다.	2
1689	4770	비누의 양이 줄어들었다.	원인	비누를 오래 사용했다.	새 비누를 구입했다.	1
1690	4771	그 여자는 10 년 이상을 배웠습니다.	결과	여자는 기타 연주를 잘한다.	여자는 기타 연주를 할 줄 모른다.	1
1691	4772	나는 아이가있는 레스토랑에 들어갔다.	결과	직원이 유아용 의자를 가져다주었다.	아이가 의자를 만들었다.	1
1692	4773	내 동생은 학교에 결석했다.	원인	누나가 배탈이 났다. 	선생님이 누나를 칭찬하셨다.	1
1693	4774	미아 가보고했다.	결과	아이가 실종되었다.	아이가 실족했다.	1
1694	4775	나는 물고기에서 썩은 것입니다.	원인	생선이 신선하다.	생선이 부패했다.	2
1695	4776	여자는 열 때문에 땀을 흘립니다.	원인	여자가 많은 조명 아래 서 있다.	여자가 반사판으로 얼굴을 밝혔다.	1
1696	4777	나는 벽에 칠해졌다.	결과	페인트를 새로 샀다.	벽에 있던 얼룩이 사라졌다.	2
1697	4778	나는 어제 체육관에서 운동했다.	결과	목이 아프다.	근육통이 생겼다.	2
1698	4779	나는 아이가 들고있는 풍선 스트랩을 놓쳤다.	결과	풍선의 바람이 빠졌다.	풍선이 하늘 위로 날라갔다.	2
1699	4780	걷고 미끄러졌다.	원인	비가 와서 땅이 젖었다	비가 와서 집에서 머물렀다.	1
1700	4781	나는 하늘에서 우발적 인 오로라를 만났습니다.	원인	북극에 와 있다.	하와이에 와 있다.	1
1701	4782	더 많은 버스가 실행되기 시작했습니다.	원인	버스를 아무도 이용하지 않는다.	버스 이용객이 늘어났다.	2
1702	4783	창을 닫았습니다.	원인	밖에서 시끄러운 소리가 들린다.	밖이 조용하다.	1
1703	4784	나는 물을 꽃에 줬다.	결과	화초가 싱싱해졌다.	화초 분갈이를 했다.	1
1704	4785	그 남자는 시장에 갔다.	결과	쯔유를 샀다.	쯔유를 만들었다.	1
1705	4786	휴대 전화가 꺼져 있습니다.	원인	휴대폰이 방전됐다.  	휴대폰 광고를 보았다.	1
1706	4787	팬이 켜졌습니다.	결과	바람이 멈췄다.	바람이 느껴졌다.	2
1707	4788	나는 메모를 잘 첨부했다.	원인	메모 내용을 잘 기억하고 싶었다.	메모 내용은 중요하지 않았다.	1
1708	4789	그것은 불이었습니다.	결과	소방차를 부른다.	경찰차를 부른다.	1
1709	4790	무릎이 아팠다.	원인	오랫동안 누워 있었다.	계단을 여러 번 오르락 내리락 했다.	2
1710	4791	여자는 비만이었습니다.	원인	여성이 패스트푸드를 자주 먹었다.	여성이 채소를 자주 먹었다.	1
1711	4792	나는 아이를 잃어 버렸다.	원인	길거리에 사람이 너무 많았다.	길거리가 한적했다.	1
1712	4793	도시의 핵 형성이 도시에 떨어졌습니다.	결과	도시가 폐허가 되었다.	도시가 재개발되었다.	1
1713	4794	나는 큰 소리로 웃었다.	원인	재미있는 이야기를 들었다.	화가 나는 이야기를 들었다.	1
1714	4795	의자의 다리가 파손되었습니다.	결과	의자가 쓰러졌다.	의자 위에 짐을 올려놓았다.	1
1715	4796	나는 무거운 짐이있었습니다.	결과	어깨가 아프다.	몸이 가벼워졌다.	2
1716	4797	비가 며칠 동안 오지 않았습니다.	결과	목이 마르다.	잔디가 시들시들해졌다.	2
1717	4798	나는 자외선 차단제를 샀다.	결과	피부가 타지 않았다.	피부가 탔다.	1
1718	4799	커튼이 묶여 있고 수정되었습니다.	결과	방에 빛이 잘 들어왔다.	방에 빛이 잘 들어오지 않았다.	1
1719	4800	복사기가있는 문서를 복사했습니다.	결과	문서가 여러 장이 되었다.	문서가 찢어졌다.	1
1720	4801	호텔 방은 가볍지 않았습니다.	원인	카드키를 방에 꽂지 않았다.	카드키를 방에 꽂았다.	1
1721	4802	한 달 안에 우리는 5kg 이상 증가했습니다.	원인	매일 밤 야식을 먹었다.	매일 밤 운동을 했다.	1
1722	4803	그 남자는 재채기를했다.	원인	남자의 코에 먼지가 들어갔다.	남자의 발에 먼지가 붙었다.	1
1723	4804	하얀 백합은 청색 안료로 물에 넣었습니다.	결과	백합의 꽃잎이 분홍색으로 물들었다.	백합의 꽃잎이 파란색으로 물들었다.	2
1724	4805	부상당한 것은 깊이 있습니다.	결과	상처가 빨리 나았다.	흉터가 남았다.	2
1725	4806	나는 마을에 기둥을 설치했다.	결과	마을에 전기가 끊겼다.	마을에 전기가 공급되었다.	2
1726	4807	그 남자는 창고에 티셔츠를 접었습니다.	원인	여름이 되었다.	겨울이 되었다.	2
1727	4808	구급차가 도착했습니다.	결과	환자가 퇴원했다.	환자가 병원으로 이송됐다.	2
1728	4809	철수는 아프다.	원인	어제 과음을 했다. 	어제 일찍 잠자리에 들었다. 	1
1729	4810	더운 여름날, 아이스크림을 실온에 오랫동안 배치했습니다.	결과	아이스크림이 얼었다.	아이스크림이 녹았다.	2
1730	4811	주차장에는 아무 곳도 없었습니다.	결과	골목길에 주차를 했다.	세차를 했다.	1
1731	4812	아이가 울었다.	원인	부모가 아이를 혼냈다.	부모가 아이 앞에서 딸랑이를 흔들었다.	2
1732	4813	나는 연필로 틀린 작문을 썼다.	결과	글씨 위에 수정 테이프칠을 했다.	지우개로 지웠다.	2
1733	4814	나는 며칠 동안 물고기를주지 않았다.	결과	물고기가 다른 물고기의 지느러미를 먹었다.	물고기가 다른 물고기의 지느러미로 장난쳤다.	1
1734	4815	케이블 라인은 현기증이 얽혀있었습니다.	결과	케이블 선을 다 잘라냈다.	케이블 선을 하나씩 풀어 정리했다.	2
1735	4816	나는 열심히 공부했다.	결과	좋은 성적을 받았다.	시험이 끝났다.	1
1736	4817	팬들은 경기장에서 팬들을 가지고있었습니다.	원인	심판이 잘못된 판정을 내렸다.	경기가 연장전으로 넘어갔다.	1
1737	4818	나는 초콜릿을 들었습니다.	결과	초콜릿이 딱딱해졌다.	초콜릿이 녹았다.	2
1738	4819	나는 큰 일기 예보를 확인했다.	결과	외투를 챙겼다.	우산을 챙겼다.	1
1739	4820	신발은 펄싱됩니다.	원인	신발을 세탁하고 햇빛에 말렸다.	물이 고인 웅덩이를 밟았다.	2
1740	4821	그 남자는 근육을 키우고 싶어합니다.	결과	남자는 컴퓨터 게임을 했다.	남자는 역기를 들었다.	2
1741	4822	남자들은 두 개의 그릇을 먹는다.	원인	남성은 매우 배가 고팠다.	남성은 매우 배가 불렀다.	2
1742	4823	나는 입이 있었어.	원인	뜨거운 음식을 먹었다.	짠 음식을 먹었다.	1
1743	4824	나는 물에서 나왔고 립스틱은 그것을 지우지 않았다.	원인	립스틱이 워터프루프이다.	립스틱이 워터프루프가 아니다.	1
1744	4825	나는 한 달 동안 열심히 일했습니다.	결과	체력이 좋아졌다.	운동장이 넓어졌다.	1
1745	4826	나는 신발 끈을 해결했다.	결과	신발이 헐렁해졌다.	신발이 헤졌다.	1
1746	4827	나는 씨앗을 심었습니다.	결과	새싹이 났다.	씨앗을 샀다.	1
1747	4828	나는 내 머리를 바에 데려 갔다.	결과	머리카락이 곱슬곱슬하게 말렸다.	머리카락이 쭉 펴졌다.	1
1748	4829	그 여인은 문장의 끝에 기간이 걸렸습니다.	원인	문장을 계속 이어 작성하고자 한다.	문장을 마무리하고자 한다.	2
1749	4830	결과, 남성은 폐암입니다.	원인	남자는 평소 기름진 음식을 많이 먹는다.	남자는 평소 담배를 자주 피웠다.	2
1750	4831	나는 비밀리에 휴대 전화를 가지고 있었다.	결과	선생님께 칭찬을 받았다.	선생님께 핸드폰을 압수당했다. 	2
1751	4832	나는 페퍼민트 사탕을 먹었습니다.	결과	입 안이 시원해진다.	입 안이 따뜻해진다.	1
1752	4833	그 남자는 차에 담배였습니다.	결과	남자의 차에서 좋은 냄새가 났다.	남자의 차에서 찌든 냄새가 났다.	2
1753	4834	배가 목적지에 도착했습니다.	결과	배를 정박했다.	배를 출발시켰다.	1
1754	4835	나는 신발을 걸었다.	결과	아무 소리도 나지 않는다.	또각또각 소리가 난다.	2
1755	4836	나는 내 머리에 왁스를 적용했다.	결과	머리가 고정되었다.	머리가 풀렸다.	1
1756	4837	빙하가 녹았다.	결과	해수면이 높아졌다.	해수면이 낮아졌다.	1
1757	4838	나는 일련의 우유를 부었다.	결과	시리얼이 바삭바삭 해졌다.	시리얼이 눅눅해졌다.	2
1758	4839	나는 고기를 팬에 게시했다.	결과	고기가 썰린다.	고기가 익는다.	2
1759	4840	축구 팀 플레이어 트로피를 리프트합니다.	원인	축구팀은 대회에서 우승했다.	축구팀은 경기에서 패배했다.	1
1760	4841	나는 전자기파가 내 몸에서 좋지 않다는 것을 들었습니다.	결과	스마트폰 사용 시간을 늘렸다.	스마트폰에 전자파 차단 스티커를 붙였다.	2
1761	4842	나는 소독을 받았다.	결과	손이 더럽다.	손이 청결하다.	2
1762	4843	한 여자는 신문을 읽습니다.	결과	여성은 투표를 한다.	여성은 선거의 결과를 알게 되었다.	2
1763	4844	JII는 커플 링입니다.	원인	지은이에게는 친구가 없다.	지은이에게는 연인이 있다.	2
1764	4845	키보드의 백 스페이스 바를 누릅니다.	결과	글자가 지워진다.	글자가 입력된다.	1
1765	4846	의자가 의자에서 떨어졌습니다.	결과	엉덩이에 멍이 들었다.	엉덩이에 몽고반점이 생겼다.	1
1766	4847	봉투의 바닥이 뚫었습니다.	결과	봉투 안의 물건이 모두 쏟아졌다.	봉투 안에 물건이 모두 담겼다.	1
1767	4848	음악이 휴대 전화에 나오기 시작했습니다.	원인	휴대폰에서 음악을 재생했다.	휴대폰에 충전기를 연결했다.	1
1768	4849	나는 태양 아래서 오랫동안 서 있었다.	결과	얼굴이 새카맣게 탔다.	해가 떴다.	1
1769	4850	책상이 흔들렸습니다.	결과	책상 위에 있던 형광펜이 떨어졌다.	책상 위에 형광펜을 칠했다.	1
1770	4851	나는 쌀에 물을 쏟아 냈고 삶은 길다.	결과	볶음밥이 만들어졌다.	죽이 만들어졌다.	2
1771	4852	무서운 흉터	원인	상처가 사라졌다	상처를 치료하지 않았다 	2
1772	4853	그것은 남자가 걸렸습니다.	원인	상한 음식을 먹었다.	익힌 음식을 먹었다.	1
1773	4854	껌은 신발에 붙어 있습니다.	원인	누군가 껌을 바닥에 뱉었다.	껌을 휴지에 싸서 버렸다.	1
1774	4855	우유의 색깔이 바뀌었다.	원인	우유에 딸기를 넣고 같이 갈았다.	우유를 발효시켰다.	1
1775	4856	그 남자는 대사관을 방문했습니다.	원인	남자는 가방을 잃어버렸다.	남자는 여권을 잃어버렸다.	2
1776	4857	김치는 세였습니다.	원인	김치를 상온에 꺼내두었다.	김치를 냉동고에 넣어두었다.	1
1777	4858	여성들은 급여를 받았습니다.	결과	여성의 통장 잔고가 늘어났다.	여성의 통장 잔고가 줄어들었다.	1
1778	4859	나는 오랫동안 콩을 볶었다.	결과	원두가 덜 익었다.	원두가 탔다.	2
1779	4860	코가 해고.	결과	휴지로 코를 막았다.	코피가 날 정도로 아프게 부딪혔다.	1
